Name,Source,Page,Description
Dragon Stories,TLotRR,29,"Skill Proficiencies.
Explore, Old LoreTool Proficiency.
A musical instrument of your choiceDistinctive Features.
Eager, Proud"
Eloquent Orator,TLotRR,32,"Skill Proficiencies.
Persuasion, RiddleTool Proficiency.
Calligrapher's suppliesDistinctive Features.
Cunning, Lordly"
Entertainer,PHB,130,"Skill Proficiencies: Acrobatics, PerformanceTool Proficiencies: Disguise kit, one type of musical instrumentEquipment: A musical instrument (one of your choice), the favor of an admirer (love letter, lock of hair, or trinket), costume clothes, and a belt pouch containing 15 gp Feature: By Popular Demand[–] You can always find a place to perform, usually in an inn or tavern but possibly with a circus, at a theater, or even in a noble's court.
At such a place, you receive free lodging and food of a modest or comfortable standard (depending on the quality of the establishment), as long as you perform each night.
In addition, your performance makes you something of a local figure.
When strangers recognize you in a town where you have performed, they typically take a liking to you."
Faceless,BGDIA,203,See source for full description
Faction Agent,SCAG,147,"Skill Proficiencies: Insight and one Intelligence, Wisdom, or Charisma skill of your choice, as appropriate to your factionLanguages: Any two of your choiceEquipment: Badge or emblem of your faction, a copy of a seminal faction text (or code-book for a covert faction), a set of common clothes, and a pouch containing 15 gp Feature: Safe Haven[–] As a faction agent, you have access to a secret network of supporters and operatives who can provide assistance on your adventures.
You know a set of secret signs and passwords you can use to identify such operatives, who can provide you with access to a hidden safe house, free room and board, or assistance in finding information.
These agents never risk their lives for you or risk revealing their true identities."
Failed Merchant,AI,49,"Skill Proficiencies: Investigation, PersuasionTool Proficiencies: One type of artisan's toolsLanguages: Any one of your choiceEquipment: One set of artisan's tools, merchant's scale, a set of fine clothes, and a belt pouch containing 10 gp Feature: Supply Chain[–] From your time as a merchant, you retain connections with wholesalers, suppliers, and other merchants and entrepreneurs.
You can call upon these connections when looking for items or information."
Far Trader,TLotRR,33,"Skill Proficiencies.
Deception, TravelTool Proficiency.
Land vehiclesDistinctive Features.
Cunning, Proud"
Far Traveler,SCAG,148,"Skill Proficiencies: Insight, PerceptionTool Proficiencies: Any one musical instrument or gaming set of your choice, likely something native to your homelandLanguages: Any one of your choiceEquipment: One set of traveler's clothes, any one musical instrument or gaming set you are proficient with, poorly wrought maps from your homeland that depict where you are in Faerûn, a small piece of jewelry worth 10 gp in the style of your homeland's craftsmanship, and a pouch containing 5 gp Feature: All Eyes on You[–] Your accent, mannerisms, figures of speech, and perhaps even your appearance all mark you as foreign.
Curious glances are directed your way wherever you go, which can be a nuisance, but you also gain the friendly interest of scholars and others intrigued by far-off lands, to say nothing of everyday folk who are eager to hear stories of your homeland.You can parley this attention into access to people and places you might not otherwise have, for you and your traveling companions.
Noble lords, scholars, and merchant princes, to name a few, might be interested in hearing about your distant homeland and people."
Far-Reaching Herald,TLotRR,43,"Skill Proficiencies.
Athletics, TravelTool Proficiency.
Land vehiclesDistinctive Features.
Bold, True-hearted"
Feylost,WBtW,9,"Skill Proficiencies: Deception, SurvivalTool Proficiencies: One type of musical instrumentLanguages: One of your choice of Elvish, Gnomish, Goblin, or SylvanEquipment: A musical instrument (one of your choice), a set of traveler's clothes, three trinkets (each determined by rolling on the Feywild Trinkets table), and a pouch containing 8 gp Feature: Feywild Connection[–] Your mannerisms and knowledge of fey customs are recognized by natives of the Feywild, who see you as one of their own.
Because of this, friendly Fey creatures are inclined to come to your aid if you are lost or need help in the Feywild."
Fisher,GoS,29,"Skill Proficiencies: History, SurvivalLanguages: One of your choiceEquipment: Fishing tackle, a net, a favorite fishing lure or oiled leather wading boots, a set of traveler's clothes, and a belt pouch containing 10 gp Feature: Harvest the Water[–] You gain advantage on ability checks made using fishing tackle.
If you have access to a body of water that sustains marine life, you can maintain a moderate lifestyle while working as a fisher, and you can catch enough food to feed yourself and up to ten other people each day."
Folk Hero,PHB,131,"Skill Proficiencies: Animal Handling, SurvivalTool Proficiencies: One type of artisan's tools, vehicles (land)Equipment: A set of artisan's tools (one of your choice), a shovel, an iron pot, a set of common clothes, and a belt pouch containing 10 gp Feature: Rustic Hospitality[–] Since you come from the ranks of the common folk, you fit in among them with ease.
You can find a place to hide, rest, or recuperate among other commoners, unless you have shown yourself to be a danger to them.
They will shield you from the law or anyone else searching for you, though they will not risk their lives for you."
Forest-Dweller,TLotRR,40,"Skill Proficiencies.
Nature, StealthTool Proficiency.
Herbalism kitDistinctive Features.
Cunning, Rustic"
Gambler,AI,49,"Skill Proficiencies: Deception, InsightTool Proficiencies: One gaming setLanguages: Any one of your choiceEquipment: One gaming set, a lucky charm, a set of fine clothes, and a belt pouch containing 15 gp Feature: Never Tell Me the Odds[–] Odds and probability are your bread and butter.
During downtime activities that involve games of chance or figuring odds on the best plan, you can get a solid sense of which choice is likely the best one and which opportunities seem too good to be true, at the DM's determination."
Gate Warden,SatO,7,"Skill Proficiencies: Persuasion, SurvivalLanguages: Two of your choice (Abyssal, Celestial, or Infernal recommended)Equipment: A ring of keys to unknown locks, a blank book, an ink pen or quill, a bottle of black ink, a set of traveler's clothes, and a pouch containing 10 gp Feature: Planar Infusion[–] Living in a gate-town or a similar location steeped you in planar energy.
You gain the Scion of the Outer Planes feat.
In addition, you know where to find free, modest lodging and food in the community you grew up in."
Gate-Warden,TLotRR,41,"Skill Proficiencies.
Intimidation, PerceptionTool Proficiency.
Carpenter's tools or woodcarver's toolsDistinctive Features.
Inquisitive, Patient"
Giant Foundling,BGG,6,See source for full description
Gifted Senses,TLotRR,30,"Skill Proficiencies.
Investigation, PerceptionTool Proficiency.
Brewer's supplies or cook's utensilsDistinctive Features.
Generous, Wilful"
Golgari Agent,GGR,53,"Skill Proficiencies: Nature, SurvivalTool Proficiencies: Poisoner's kitLanguages: Choose one of Elvish, Giant, or KraulEquipment: A Golgari insignia, a poisoner's kit, a pet beetle or spider, a set of common clothes, and a belt pouch containing 10 gp worth of mixed coins Feature: Undercity Paths[–] You know hidden, underground pathways that you can use to bypass crowds, obstacles, and observation as you move through the city.
When you aren't in combat, you and companions you lead can travel between any two locations in the city twice as fast as your speed would normally allow.
The paths of the undercity are haunted by dangers that rarely brave the light of the surface world, so your journey isn't guaranteed to be safe."
Grounded,HumblewoodCampaignSetting,44,See source for full description
Gruul Anarch,GGR,60,"Skill Proficiencies: Animal Handling, AthleticsTool Proficiencies: Herbalism kitLanguages: Choose one of Draconic, Giant, Goblin, or SylvanEquipment: A Gruul insignia, a hunting trap, an herbalism kit, the skull of a boar, a beast-hide cloak, a set of traveler's clothes, and a belt pouch containing 10 gp (Azorius 1-zino coins) Feature: Rubblebelt Refuge[–] You are intimately familiar with areas of the city that most people shun: ruined neighborhoods where wurms rampaged, overgrown parks that no hand has tended in decades, and the vast, sprawling rubblebelts of broken terrain that civilized folk have long abandoned.
You can find a suitable place for you and your allies to hide or rest in these areas.
In addition, you can find food and fresh water in these areas for yourself and up to five other people each day."
Guild Artisan,PHB,132,"Skill Proficiencies: Insight, PersuasionTool Proficiencies: One type of artisan's toolsLanguages: One of your choiceEquipment: A set of artisan's tools (one of your choice), a letter of introduction from your guild, a set of traveler's clothes, and a belt pouch containing 15 gp Feature: Guild Membership[–] As an established and respected member of a guild, you can rely on certain benefits that membership provides.
Your fellow guild members will provide you with lodging and food if necessary, and pay for your funeral if needed.
In some cities and towns, a guildhall offers a central place to meet other members of your profession, which can be a good place to meet potential patrons, allies, or hirelings.Guilds often wield tremendous political power.
If you are accused of a crime, your guild will support you if a good case can be made for your innocence or the crime is justifiable.
You can also gain access to powerful political figures through the guild, if you are a member in good standing.
Such connections might require the donation of money or magic items to the guild's coffers.You must pay dues of 5 gp per month to the guild.
If you miss payments, you must make up back dues to remain in the guild's good graces."
Haunted One,VRGR,34,"Skill Proficiencies: Choose two from among Arcana, Investigation, Religion, or SurvivalLanguages: Choose two, one of which must be Abyssal, Celestial, Deep Speech, Draconic, Infernal, Primordial, Sylvan, or UndercommonEquipment: Monster hunter's pack (containing a chest, a crowbar, a hammer, three wooden stakes, a holy symbol, a flask of holy water, a set of manacles, a steel mirror, a flask of oil, a tinderbox, and 3 torches), a set of common clothes, one trinket of special significance (choose one or roll on the Horror Trinkets table), and 1 sp Feature: Heart of Darkness[–] Those who look into your eyes can see that you have faced unimaginable horror and that you are no stranger to darkness.
Though they might fear you, commoners will extend you every courtesy and do their utmost to help you.
Unless you have shown yourself to be a danger to them, they will even take up arms to fight alongside you, should you find yourself facing an enemy alone."
Healing Hands,TLotRR,30,"Skill Proficiencies.
Medicine, TravelTool Proficiency.
Herbalism kit or water vehiclesDistinctive Features.
Bold, Generous"
Hermit,PHB,134,"Skill Proficiencies: Medicine, ReligionTool Proficiencies: Herbalism kitLanguages: One of your choiceEquipment: A scroll case stuffed full of notes from your studies or prayers, a winter blanket, a set of common clothes, an herbalism kit, and 5 gp Feature: Discovery[–] The quiet seclusion of your extended hermitage gave you access to a unique and powerful discovery.
The exact nature of this revelation depends on the nature of your seclusion.
It might be a great truth about the cosmos, the deities, the powerful beings of the outer planes, or the forces of nature.
It could be a site that no one else has ever seen.
You might have uncovered a fact that has long been forgotten, or unearthed some relic of the past that could rewrite history.
It might be information that would be damaging to the people who or consigned you to exile, and hence the reason for your return to society.Work with your DM to determine the details of your discovery and its impact on the campaign."
House Agent,ERLW,53,See source for full description
Hunter of Orcs,TLotRR,43,"Skill Proficiencies.
Hunting, StealthTool Proficiency.
Leatherworker's tools or woodcarver's toolsDistinctive Features.
Bold, Stern"
Inheritor,SCAG,150,See source for full description
Investigator,VRGR,35,"Skill Proficiencies: Choose two from among Insight, Investigation, or PerceptionTool Proficiencies: Disguise kit, Thieves' toolsEquipment: A magnifying glass, evidence from a past case (choose one or roll for a trinket from the Horror Trinkets later in this chapter), a set of common clothes, and 10 gp Feature: Official Inquiry[–] You're experienced at gaining access to people and places to get the information you need.
Through a combination of fast-talking, determination, and official-looking documentation, you can gain access to a place or an individual related to a crime you're investigating.
Those who aren't involved in your investigation avoid impeding you or pass along your requests.
Additionally, local law enforcement has firm opinions about you, viewing you as either a nuisance or one of their own."
Izzet Engineer,GGR,66,"Skill Proficiencies: Arcana, InvestigationTool Proficiencies: One type of artisan's toolsLanguages: Choose one of Draconic, Goblin, or VedalkenEquipment: An Izzet insignia, one set of artisan's tools, the charred and twisted remains of a failed experiment, a hammer, a block and tackle, a set of common clothes, and a belt pouch containing 5 gp (Azorius 1-zino coins) Feature: Urban Infrastructure[–] The popular conception of the Izzet League is based on mad inventions, dangerous experiments, and explosive blasts.
Much of that perception is accurate, but the league is also involved with mundane tasks of construction and architecture—primarily in crafting the infrastructure that allows Ravnicans to enjoy running water, levitating platforms, and other magical and technological wonders.You have a basic knowledge of the structure of buildings, including the stuff behind the walls.
You can also find blueprints of a specific building in order to learn the details of its construction.
Such blueprints might provide knowledge of entry points, structural weaknesses, or secret spaces.
Your access to such information isn't unlimited.
If obtaining or using the information gets you in trouble with the law, the guild can't shield you from the repercussions."
Keeper of Lore,TLotRR,43,"Skill Proficiencies.
Investigation, Old LoreTool Proficiency.
Calligrapher's suppliesDistinctive Features.
Honourable, True-hearted"
Knight of Solamnia,DSotDQ,30,"Skill Proficiencies: Athletics, SurvivalLanguages: Two of your choiceEquipment: An insignia of rank, a deck of cards, a set of common clothes, and a pouch containing 10 gp Feature: Squire of Solamnia[–] You gain the Squire of Solamnia feat.In addition, the Knights of Solamnia provide you free, modest lodging and food at any of their fortresses or encampments."
Knight of the Order,SCAG,151,"Skill Proficiencies: Persuasion, plus one from among Arcana, History, Nature, and Religion, as appropriate for your orderTool Proficiencies: Your choice of a gaming set or a musical instrumentLanguages: Any one of your choiceEquipment: One set of traveler's clothes, a signet, banner, or seal representing your place or rank in the order, and a pouch containing 10 gp Feature: Knightly Regard[–] You receive shelter and succor from members of your knightly order and those who are sympathetic to its aims.
If your order is a religious one, you can gain aid from temples and other religious communities of your deity.
Knights of civic orders can get help from the community—whether a lone settlement or a great nation—that they serve, and knights of philosophical orders can find help from those they have aided in pursuit of their ideals, and those who share their ideals.This help comes in the form of shelter and meals, and healing when appropriate, as well as occasionally risky assistance, such as a band of local citizens rallying to aid a sorely pressed knight, or those who support the order helping to smuggle a knight out of town when he or she is being hunted unjustly."
Lorehold Student,SCC,31,See source for full description
Mage of High Sorcery,DSotDQ,30,"Skill Proficiencies: Arcana, HistoryLanguages: Two of your choiceEquipment: A bottle of colored ink, an ink pen, a set of common clothes, and a pouch containing 10 gp Feature: Initiate of High Sorcery[–] You gain the Initiate of High Sorcery feat.In addition, the Mages of High Sorcery provide you with free, modest lodging and food indefinitely at any occupied Tower of High Sorcery and for one night at the home of an organization member."
Mageborn,DungeonsDrakkenheim,245,See source for full description
Maker of Ships,TLotRR,36,"Skill Proficiencies.
Acrobatics, AthleticsTool Proficiency.
Carpenter's toolsDistinctive Features.
Eager, Lordly"
Marine,GoS,31,"Skill Proficiencies: Athletics, SurvivalTool Proficiencies: Vehicles (water, land)Equipment: A dagger that belonged to a fallen comrade, a folded flag emblazoned with the symbol of your ship or company, a set of traveler's clothes, and a belt pouch containing 10 gp Feature: Steady[–] You can move twice the normal amount of time (up to 16 hours) each day before being subject to the effect of a forced march (see ""Travel Pace"" in chapter 8 of the Player's Handbook).
Additionally, you can automatically find a safe route to land a boat on shore, provided such a route exists."
Mechanic,ObojimaTallGrass,155,"Skill Proficiencies: Mechanics, SalvageTool Proficiencies: You gain proficiency in three Artisan's Tools of your choice.Equipment: An abacus, ball bearings (1000), block and tackle, flask of oil, an unfinished mechanical trinket, and 15 gold flowers.You've spent most of your life working on mechanisms and machines.
For you, understanding both new and old technology requires a more hands on approach.
Through trial and error, you have learned to create, repair, and modify all things mechanical and electronic, and you have honed your eye to recognize useful parts among the scattered bits of technology that are found throughout the island.
Feature: Machine Whisperer[–] You have a knack for machines and can tell what state one is in by spending a few minutes with it.
Machines that have been sundered are unusable and should be scrapped for parts.
Machines in disrepair could potentially function again if someone fixed them up, and functioning machines do just that.
Function!"
Mercenary Veteran,SCAG,152,"Skill Proficiencies: Athletics, PersuasionTool Proficiencies: One type of gaming set, vehicles (land)Equipment: A uniform of your company (traveler's clothes in quality), an insignia of your rank, a gaming set of your choice, and a pouch containing the remainder of your last wages (10 gp).
Feature: Mercenary Life[–] You know the mercenary life as only someone who has experienced it can.
You are able to identify mercenary companies by their emblems, and you know a little about any such company, including who has hired them recently.
You can find the taverns and festhalls where mercenaries abide in any area, as long as you speak the language.
You can find mercenary work between adventures sufficient to maintain a comfortable lifestyle (see ""Practicing a Profession"" under ""Downtime Activities"" in chapter 8 of the Player's Handbook)."
No Longer Free from Care and Fear,TLotRR,41,"Skill Proficiencies.
Deception, InvestigationTool Proficiency.
A gaming set or a musical instrument of your choiceDistinctive Features.
Inquisitive, Rustic"
Noble,PHB,135,"Skill Proficiencies: History, PersuasionTool Proficiencies: One type of gaming setLanguages: One of your choiceEquipment: A set of fine clothes, a signet ring, a scroll of pedigree, and a purse containing 25 gp Feature: Position of Privilege[–] Thanks to your noble birth, people are inclined to think the best of you.
You are welcome in high society, and people assume you have the right to be wherever you are.
The common folk make every effort to accommodate you and avoid your displeasure, and other people of high birth treat you as a member of the same social sphere.
You can secure an audience with a local noble if you need to."
Off with Dwarves,TLotRR,41,"Skill Proficiencies.
Animal Handling, TravelTool Proficiency.
Land vehiclesDistinctive Features.
Fair-spoken, Faithful"
On Patrol,TLotRR,38,"Skill Proficiencies.
Investigation, TravelTool Proficiency.
Brewer's suppliesDistinctive Features.
Inquisitive, Wary"
Orzhov Representative,GGR,72,"Skill Proficiencies: Intimidation, ReligionLanguages: Two of your choiceEquipment: An Orzhov insignia, a foot-long chain made of ten gold coins, vestments, a set of fine clothes, and a belt pouch containing 1 pp (an Orzhov-minted 10-zino coin) Feature: Leverage[–] You can exert leverage over one or more individuals below you in the guild's hierarchy and demand their help as needs warrant.
For example, you can have a message carried across a neighborhood, procure a short carriage ride without paying, or have others clean up a bloody mess you left in an alley.
The DM decides if your demands are reasonable and if there are subordinates available to fulfill them.
As your status in the guild improves, you gain influence over more people, including ones in greater positions of power."
Outlander,PHB,136,"Skill Proficiencies: Athletics, SurvivalTool Proficiencies: One type of musical instrumentLanguages: One of your choiceEquipment: A staff, a hunting trap, a trophy from an animal you killed, a set of traveler's clothes, and a belt pouch containing 10 gp Feature: Wanderer[–] You have an excellent memory for maps and geography, and you can always recall the general layout of terrain, settlements, and other features around you.
In addition, you can find food and fresh water for yourself and up to five other people each day, provided that the land offers berries, small game, water, and so forth."
Plaintiff,AI,50,"Skill Proficiencies: Medicine, PersuasionTool Proficiencies: One type of artisan's toolsLanguages: Any one of your choiceEquipment: One set of artisan's tools, fine clothes, 20 gp Feature: Legalese[–] Your experience with your local legal system has given you a firm knowledge of the ins and outs of that system.
Even when the law is not on your side, you can use complex terms like ex injuria jus non oritur and cogitationis poenam nemo patitur to frighten people into thinking you know what you're talking about.
With common folks who don't know any better, you might be able to intimidate or deceive to get favors or special treatment."
Planar Philosopher,SatO,8,See source for full description
Prismari Student,SCC,32,See source for full description
Protector of the Land,TLotRR,43,"Skill Proficiencies.
Nature, MedicineTool Proficiency.
Herbalism kitDistinctive Features.
Honourable, Subtle"
Quandrix Student,SCC,33,See source for full description
Rakdos Cultist,GGR,79,See source for full description
Restless Farmer,TLotRR,38,"Skill Proficiencies.
Animal Handling, NatureTool Proficiency.
Cook's utensils or herbalism kitDistinctive Features.
Faithful, Rustic"
Rewarded,BMT,57,"Skill Proficiencies: Insight, PersuasionLanguages: One of your choiceEquipment: A bottle of black ink, an ink pen, five sheets of paper, a gaming set (matching your chosen proficiency), a signet ring, a set of fine clothes, and a pouch containing 18 gpTool Proficiencies: One gaming set of your choice (such as playing cards or three-dragon ante cards) Feature: Fortune's Favor[–] Your unexpected good fortune is reflected by a minor boon.
You gain the Lucky, Magic Initiate, or Skilled feat (your choice).
Your choice of feat reflects the transformation that changed your life.
An encounter with a genie who gave you three wishes might have resulted in magical powers represented by Magic Initiate.
If you paid off all your family debts with a fortuitous round of three-dragon ante, you might be Lucky instead.
Alternatively, you could use the Skilled feat to reflect whatever trial you endured to secure your new destiny and to model the knowledge and abilities imparted to you by whatever force transformed your life."
Rival Intern,AI,51,"Skill Proficiencies: History, InvestigationTool Proficiencies: One type of artisan's toolsLanguages: Any one of your choiceEquipment: One set of artisan's tools, a ledger from your previous employer containing a small piece of useful information, a set of fine clothes, and a belt pouch containing 10 gp Feature: Inside Informant[–] You have connections to your previous employer or other groups you dealt with during your previous employment.
You can communicate with your contacts, gaining information at the DM's discretion."
